{
  "experiment_id": "experiment-study-003-affinity-identity-ladder-v1",
  "extensions": {
    "studio/frame-policy": "all 5000 points; steps 0-240 at 30fps; no interpolation; Canvas display persistence",
    "studio/identity-manifest": "work/studies/study-003-nonlocal-affinity-dance/20-behavior/comparisons/affinity-identity-ladder-v1/identity-ladder-manifest.json",
    "studio/identity-role": "planar VEX replay of exact Canvas Mulberry32 graph and events",
    "studio/legacy-path": "work/studio/handoffs/study-003-affinity-identity-ladder-v1/affinity-identity-planar-5k-30fps.mp4",
    "studio/review-receipt": "work/studies/study-003-nonlocal-affinity-dance/20-behavior/comparisons/affinity-identity-ladder-v1/review-planar/review-receipt.json",
    "studio/state-authority": "vex-geometry"
  },
  "id": "artifact-study-003-affinity-identity-planar-5k-30fps-v1",
  "path": "studies/study_003_nonlocal-affinity-dance/01_behavior/02_review/migrated_verified/artifact-study-003-affinity-identity-planar-5k-30fps-v1/affinity-identity-planar-5k-30fps.mp4",
  "schema_version": 1,
  "sha256": "sha256:8e895e1ac1c4e692f24e642c6eaf3feb428c6f7025619aec9465a29aa321d571",
  "state": "verified",
  "track": "behavior",
  "verified": true,
  "visibility": "private"
}
